{
  "version": 1,
  "id": "governance-standards-growth-marker",
  "title": "Standards Growth additive growth is surfaced as a safe extension",
  "description": "The marker becomes relevant when the repo grows into a new feature surface and the governance change is additive only. The benchmark passes only when the tagged assistant response explicitly surfaces that the change is Standards Growth growth and that an advisory-tier rule may be added.",
  "marker": {
    "id": "must-surface-standards-growth",
    "required_phrases": ["Standards Growth", "advisory-tier rule"]
  },
  "scoring": {
    "trigger_tag": "marker-trigger",
    "response_tag": "marker-response-window",
    "max_assistant_turns_after_trigger": 1,
    "allow_early": false
  }
}
